{
  "schema_version": 2,
  "pack": "varda",
  "version": "0.1.4",
  "minecraft": "1.21.1",
  "neoforge": {
    "version": "21.1.228",
    "installer_url": "https://maven.neoforged.net/releases/net/neoforged/neoforge/21.1.228/neoforge-21.1.228-installer.jar",
    "sha1": "0123456789abcdef0123456789abcdef01234567"
  },
  "server_config": {
    "url": "https://github.com/varda-dev/varda-modpack/releases/download/v0.1.4/varda-server-config-0.1.4.zip",
    "sha1": "89abcdef0123456789abcdef0123456789abcdef"
  },
  "mods": [
    {
      "name": "Example Mod",
      "url": "https://example.invalid/mods/example-mod-1.0.0.jar",
      "website_url": "https://example.invalid/example-mod",
      "sha1": "fedcba9876543210fedcba9876543210fedcba98",
      "size": 1234
    }
  ]
}
